Ignore,Key,Message
Y,メッセージ,
,msg1,"Ồ, tôi biết!<br>Bạn có muốn nghe<br>chuyện trước khi<br>Dezzy ở đây thoải mái<br>với đầu của tôi không?"
,msg2,Tôi đang ở nơi khác – 
,msg3,một nơi giống như quê<br>hương của tôi... 
,msg4,"Nơi đó hoàn toàn trái<br>ngược với ở đây – hoàn toàn<br>không có sự sống và im lặng,<br>giống như thế giới đã kết<br>thúc từ lâu lắm rồi."
,msg5,"Tôi nghe nói có những<br>người trong quá khứ đã<br>cố gắng cứu thế giới đó, "
,msg6,nhưng tôi đoán việc<br>đó không suôn sẻ lắm.
