Ignore,Key,Message
Y,メッセージ,
,msg1,เมื่อข้าโตขึ้น<br>ข้าก็ได้เรียนรู้ทักษะต่าง ๆ<br>ที่ผู้ที่ต้องการเป็นไวกิ้ง<br>จำเป็นต้องรู้ เช่น 
,msg2,วิธีการพายเรือ<br>แล้วก็วิธีใช้ขวานกำปั้น
,msg3,แต่แล้ววันนั้นก็มาถึง<br>วันที่คำสาปถูกปล่อย<br>ลงมาจากท้องฟ้า
,msg4,โลกที่ข้ารู้จักมาทั้งชีวิต...<br>ทะเลสาบงาม ภูเขาเขียว...<br>ทุกสิ่งล้วนต้องสาปโดยคริสตัล
,msg5,...แม้กระทั่งครอบครัวของข้า
,msg6,ทุกสิ่งที่ข้ารักหายไปในพริบตา...<br>แต่ข้าไม่ได้ร้องไห้หรอกนะ
,msg7,ข้าคือไวกิ้ง... 
,msg8,ไวกิ้งจะต้องเข้มแข็ง...!
