Ignore,Key,Message
Y,メッセージ,
,msg1,"Khi lớn hơn, tôi ngày càng<br>học được nhiều kỹ năng mà<br>một người Viking dũng<br>mãnh cần phải biết. "
,msg2,Như cách chèo thuyền và<br>cách sử dụng rìu đá.
,msg3,Và rồi cái ngày định mệnh<br>ấy đến—ngày mà Lời Nguyền<br>từ trên trời giáng xuống.
,msg4,"Thế giới nơi tôi đã lớn<br>lên—những hồ nước xinh đẹp,<br>những ngọn núi xanh thẳm...<br>Mọi thứ đều bị các<br>tinh thể nghiền nát."
,msg5,...Ngay cả gia đình tôi.
,msg6,"Tất cả những điều tôi<br>yêu quý đã tan biến<br>trong nháy mắt...<br>Nhưng, tôi không khóc."
,msg7,Tôi là một người Viking... 
,msg8,Người Viking thì<br>phải mạnh mẽ...!
