Ignore,Key,Message
Y,メッセージ,
,msg1,J'ai grandi dans le plus <br>paisible des villages.
,msg2,"Nos ancêtres, les Vikings, <br>se seraient établis ici il y a <br>bien longtemps."
,msg3,Mais j'étais trop petite pour <br>savoir qui étaient vraiment <br>ces Vikings.
,msg4,"Avant de m'endormir, <br>je demandais à mon père <br>de me raconter chaque soir <br>des histoires sur nos ancêtres."
,msg5,"Aventures passionnantes, <br>batailles héroïques, <br>grandes fêtes... "
,msg6,On y trouvait de tout ! <br>J'étais en admiration <br>devant ces soldats des mers !
,msg7,C'est ce qui m'a poussée <br>à prendre cette décision. 
,msg8,"Moi aussi, j'allais devenir <br>une Viking un jour !"
