Ignore,Key,Message
Y,メッセージ,
,msg1,I was raised in <br>a very peaceful village.
,msg2,It’s said that the ones who <br>settled here long ago were <br>the mighty Vikings—<br>our ancestors.
,msg3,"Since I was just a kid, <br>I knew absolutely nothing <br>about the Vikings."
,msg4,"So before bed each night, <br>I’d ask Dad to tell me <br>all kinds of stories about <br>our great ancestors."
,msg5,"Heart-pounding adventures, <br>awe-inspiring battles, <br>and even festive banquets!"
,msg6,The warriors of the sea <br>were so cool and powerful!
,msg7,And so I made my decision—
,msg8,"one day, I was going to <br>become a Viking!"
