Ignore,Key,Message
Y,メッセージ,
,msg1,"La reina Amleth y el maestre, <br>una me inspiró a pelear, <br>y el otro me extendió su mano."
,msg2,"Ambos son mis aspiraciones, <br>mis héroes."
,msg3,"Todavía tengo un largo camino <br>por delante si quiero convertirme <br>en un verdadero vikingo, "
,msg4,"Después de todo, <br>no me queda nada en <br>las ruinas de mi pasado."
,msg5,Por eso decidí solo <br>mirar hacia adelante.
,msg6,"Un día, cuando todo esto termine... <br>espero que mis aventuras se <br>conviertan en el cuento de <br>alguien antes de dormir."
,msg7,pero lo haré paso a paso.
