Ignore,Key,Message
Y,メッセージ,
,msg1,The piercing sound of steel <br>brought me back to my senses.
,msg2,I could make out an eerie light <br>getting cleaved into two.
,msg3,Standing within the <br>crystal fragments was...<br>a black-caped hero...
,msg4,That was the day <br>I met Queen Amleth!
,msg5,"Queen Amleth saved me, <br>flipping her cape and leaving <br>without even giving me time <br>to thank her."
,msg6,It was my first time <br>seeing Her Highness. <br>She was so pretty...<br>so cool...
,msg7,She was exactly like <br>the Vikings I admired <br>so much...!
