Ignore,Key,Message
Y,メッセージ,
,msg1-1,"“Con biết đấy, "
,msg1-2,Phù Thủy không phải là<br>những người duy nhất không<br>thể làm những gì họ muốn. 
,msg1-3,Con nên chấp nhận sự thật đi.”
,msg2,Đó là câu cửa miệng<br>mẹ tôi thường nói.
,msg3-1,"Chúng tôi phải sống<br>ẩn dật trong ngôi làng<br>nằm sâu trong núi, "
,msg3-2,và phải từ bỏ việc<br>hưởng thụ cuộc sống.
,msg4,"Tôi nghĩ rằng mình đã<br>có thể chấp nhận điều này,<br>nhưng đâu đó sâu thẳm trong<br>trái tim tôi vẫn đang gào thét."
,msg5,"“Mình có thực sự cảm thấy ổn<br>khi cứ sống như thế này không?!<br>Chúa ơi, con thật là một kẻ hèn nhát!”"
