Ignore,Key,Message
Y,メッセージ,
,msg1,"Từ khi sinh ra,<br>tôi đã là một phù thủy."
,msg2-1,"Lớn lên trong một ngôi làng<br>mà cư dân chỉ gồm các phù<br>thủy và gia đình của họ, "
,msg2-2,tôi dần trưởng thành với<br>suy nghĩ rằng trở thành phù<br>thủy là điều bình thường.
,msg3,"Mẹ tôi là phù thủy,<br>và tất cả hàng xóm của<br>tôi cũng đều là phù thủy."
,msg4,Xoay quanh toàn bộ cuộc<br>sống của tôi đều là phù thủy
,msg5,"Theo lệ làng, tôi phải cố gắng<br>không để bản thân mình có dính<br>líu gì đến “người bình thường”..."
,msg6-1,...nhưng những người trong<br>những cuốn sách mà tôi đã<br>đọc—những người được sống<br>một cuộc sống tự do theo cách<br>mình muốn ở thế giới bên ngoài—
,msg6-2,khiến tôi vô cùng ghen tị.
