Ignore,Key,Message
Y,メッセージ,
,msg1,We all came to play<br>at the lake today.
,msg2,"Me and Cerberus played <br>underwater tag, <br>a bunch of us played <br>shark attack with Moddey <br>and chased her around..."
,msg3,"Then after that, <br>a little bit of trouble happened... <br>Still, I had so much fun!"
,msg4,"But, as we were <br>coming back from the lake...<br>there was even bigger trouble."
,msg5,"It happened right when <br>everyone was changing clothes. <br>I was done, but everyone looked <br>like they needed more time..."
,msg6,Hmmm? Who’s there?
,msg7,Huh? Master? <br>Why are you waving me <br>to come over there?
,msg8,"H-Hey, wait up, Master!"
