Ignore,Key,Message
Y,メッセージ,
,msg1-1,"One day, I received a <ct=3000>letter</ct>—"
,msg1-2,the first one since coming to <br>my lord’s estate.
,msg2,"I knew who sent it. <br>And exactly because of that, <br>I couldn’t bring myself to open it."
,msg3,It’s her... 
,msg4,Did she get impatient <br>with me since I’ve been <br>running away from her <br>plea for help for so long?
,msg5-1,I’m happy for the <ct=3000>letter</ct>...
,msg5-2,but I can’t open it... <br>Not with the way I am right now.
,msg6,"Because if I open up the letter, <br>they’ll be able to see just how <br>weak and ugly I really am."
