Ignore,Key,Message
Y,メッセージ,
,msg1,Ta tự hỏi bắt đầu khi nào<br>mà mọi người lại gọi ta là<br>“Phù Thủy Rừng Sâu”?
,msg2,Phù Thủy là những người<br>duy nhất từng tìm thấy ta<br>nên có lẽ một trong số họ<br>đã bắt gọi ta với các tên đó.
,msg3,"Ta sinh sống ở tận<br>sâu trong khu rừng,<br>tránh tiếp xúc với con người...<br>Nên đó thực sự là biệt danh<br>hoàn hảo dành cho ta."
,msg4,"Này, Người Học Việc,<br>cậu sẽ lắng nghe câu<br>chuyện của ta chứ?"
,msg5,Câu chuyện về sư phụ của ta... 
,msg6,và sai lầm không bao<br>giờ có thể sửa chữa<br>mà ta đã mắc phải... 
