Ignore,Key,Message
Y,メッセージ,
,msg1-1,Hay otra Charlotte dentro de mí. 
,msg1-2,Hemos sido inseparables desde <br>el día en que ella llegó a mi vida.
,msg2-1,Pero la única persona <br>que lo sabe soy yo.
,msg2-2,"Soy todo lo que ella tiene, <br>al igual que ella es todo <br>lo que tengo."
,msg3-1,"Es un poco excéntrica, <br>hasta estalla cuando <br>algo no le gusta. "
,msg3-2,"Pero le encantan los bocadillos, <br>igual que a mí."
,msg4-1,"Así que, cuando parece que <br>está a punto de enojarse, <br>como un bocadillo. "
,msg4-2,"De esa manera, se calma... <br>y ya no sale."
