Ignore,Key,Message
Y,メッセージ,
,msg1-1,Mon corps abrite une<br>autre version de moi.
,msg1-2,J'en ai pris conscience <br>dès ma naissance.
,msg2-1,Même si je reste <br>la seule au courant.
,msg2-2,Je suis la seule pour elle <br>et elle est la seule pour moi.
,msg3-1,Elle laisse éclater sa colère dès <br>que quelque chose la contrarie. 
,msg3-2,Et elle adore les bonbons. <br>Tout pareil que moi.
,msg4-1,C'est pour ça que je mange <br>des bonbons dès que je sens <br>que je vais perdre le contrôle. 
,msg4-2,Ce qui l'empêche de sortir <br>de moi.
