Ignore,Key,Message
Y,メッセージ,
,msg1,"I accompanied <br>the man with the staff, <br>and we headed towards <br>the Stargazing Tower."
,msg2-1,"With each step inside, <br>I felt us drawing closer <br>to the Princess’s heart."
,msg2-2,"This thick, enshrouding fog was <br>surely the very manifestation <br>of her anxieties."
,msg3-1,"The Princess had always <br>feigned composure, <br>all while being afraid <br>someone might die."
,msg3-2,"Many saw that as strength, <br>and none had ever <i>tried</i> <br>looking behind her facade."
,msg4,I’m just as guilty. <br>I never noticed <br>how you truly felt...
,msg5,But...it’s clear to me now... <br>The meaning behind <br>your words that day.
,msg6,"We finally arrived <br>at the top of the tower. <br>There she was, <br>as if reigning supreme over <br>all that lay beneath her feet."
