Ignore,Key,Message
Y,メッセージ,
,msg1,Pasaron los días y pude terminar <br>su retrato justo cuando mis <br>materiales estaban a punto <br>de agotarse.
,msg2,
,msg3,"Pero, este cuadro probablemente <br>se pudrirá después de mi <br>muerte, ¿no?"
,msg4,"Está bien, supongo. <br>Es normal."
,msg5,"Pero, el hecho de que una vez <br>hubiera una ciudad aquí... <br>el hecho de que una vez <br>la gente viviera felizmente <br>su vida aquí... "
,msg6,Es un poco triste que esos <br>recuerdos se desvanezcan.
,msg7,"Cuando deje de llover, <br>supongo que pintaré un <br>cuadro aún más grande."
