Ignore,Key,Message
Y,メッセージ,
,msg1,"ข้าคือสิ่งที่ผู้คนเรียกว่า<br>""แม่มด "
,msg2,และข้าก็รู้ว่าโลกนี้มอ<br>งว่าข้าเป็นสิ่งขวางหูขวางตา
,msg3,นั่นคือเหตุผลที่ข้าเลื<br>อกอยู่ในซากปรักหักพัง 
,msg4,เพราะข้ามั่นใจว่าคงไ<br>ม่มีที่ใดจะยอมรับข้าอยู่แล้ว
,msg5,ขณะที่ความคิดเหล่านั้น<br>แล่นเข้ามาในหัวของข้า<br>ข้าสังเกตเห็นเงาของร่างไ<br>ร้วิญญาณในตึกร้างหลังหนึ่ง
,msg6,ร่างนั้น...<br>เหมือนกับเพื่อนในวัยเด็กของข้า
,msg7,...อา เจ้าคงถูกอสูรสักตัว<br>ฆ่าตอนที่หนีออกจากเมืองสินะ
,msg8,ครั้งก่อนก็ลูกศิษย์ของข้า...<br>คราวนี้ก็เป็นเจ้า...<br>พวกเจ้าทุกคนล้วนโชคร้ายนัก
