Ignore,Key,Message
Y,メッセージ,
,msg1,"Éramos eu,<br>meu pai e nossa<br>cadelinha Laila. "
,msg2,A gente morava junto<br>em um vilarejo rural<br>bem distante da<br>cidade grande.
,msg3,Minha mãe acabou<br>falecendo quando me<br>deu à luz.
,msg4,"Meu pai era calado<br>e desajeitado —<br>horrível pra cozinhar,<br>lavar ou fazer o que<br>fosse na casa."
,msg5,Por isso eu fazia<br>tudo no lugar dele.
,msg6,Acho que foi isso que me<br>fez gostar de tomar<br>conta das pessoas.
,msg7,"Os moradores da vila<br>diziam que guardar<br>túmulos era uma profissão<br>de mau agouro e<br>evitavam a gente,<br>mas eu não me<br>importava com isso."
,msg8,Afinal eu achava o<br>nosso dia a dia divertido.
