Ignore,Key,Message
Y,メッセージ,
,msg1,Halaman ini tampak lebih <br>usang dari yang lainnya.
,msg2,Ini pasti yang paling ku suka.
,msg3,Itu hanyalah catatan <br>diari biasa tentang aku <br>pergi ke pesta.
,msg4,"Tapi, aku pasti menikmatinya <br>karena aku sangat cerewet <br>di situ."
,msg5,"Aku terus membaca tanpa <br>banyak berpikir, tetapi sebuah <br>lubang perlahan-lahan mulai <br>menggerogoti hatiku."
,msg6,Aku tidak tahu siapa yang <br>bersenang-senang dalam <br>catatan di buku harian ini.
,msg7,Rasanya seperti teman-temanku <br>diambil dariku.
,msg8,Aku selalu menyalahkan diriku <br>setiap kali aku cemburu pada <br>diriku di masa lalu.
