Ignore,Key,Message
Y,メッセージ,
,msg1,Trang này có vẻ cũ<br>hơn những trang khác. 
,msg2,Chắc hẳn nó là một trong<br>những trang yêu thích của tôi.
,msg3,Chỉ là một mục nhật ký bình<br>thường ghi lại việc đi dự tiệc.
,msg4,"Nhưng, tôi hẳn đã rất<br>thích thú vì tôi nói nhiều<br>hơn bình thường trong đó."
,msg5,"Tôi tiếp tục đọc mà<br>không suy nghĩ nhiều,<br>nhưng một lỗ hổng dần<br>bắt đầu ăn mòn trái tim tôi."
,msg6,Tôi không biết người<br>đang tận hưởng niềm<br>vui trong mục nhật ký này.
,msg7,Cảm giác như thể bạn bè<br>của tôi đã bị lấy đi khỏi tôi. 
,msg8,Mỗi lần như vậy tôi lại tự dằn<br>vặt mình vì tôi ghen tị biết bao<br>với chính mình trong quá khứ.
