Ignore,Key,Message
Y,メッセージ,
,msg1,Die Seite hier sieht schon <br>recht mitgenommen aus. 
,msg2,Muss wohle eine meiner <br>Lieblingserinnergungen sein.
,msg3,"Eigentlich nur ein ganz <br>normaler Tagebucheintrag, <br>wo ich an einer Party war."
,msg4,"Aber ich muss sie <br>sehr genossen haben, <br>anzumerken von <br>meinem ungewöhnlich <br>gesprächigem Schreibstil."
,msg5,"Ich lese ohne großes <br>Bedenken weiter, <br>doch langsam nagt sich eine <br>Leere durch mein Herz."
,msg6,"Ich kenne die Person, <br>die sich da auf der <br>Party amüsiert, <br>gar nicht."
,msg7,"Es fühlt sich so an, <br>als sie mir meine <br>Freunde stiehlt. "
,msg8,"Jedes Mal hasse <br>ich mich dafür, <br>wie neidisch ich auf <br>mein früheres Selbst bin."
