Ignore,Key,Message
Y,メッセージ,
,msg1,"Cứ sau bảy ngày,<br>trí nhớ của tôi<br>lại được thiết lập lại."
,msg2,"Có lẽ để bù đắp cho điều đó,<br>tôi có thể nhớ mọi chi tiết<br>sống động trong bảy ngày đó. "
,msg3,Đó là sức mạnh kỳ diệu mà<br>tôi đã được ban cho.
,msg4,"Tôi sử dụng sức mạnh đó<br>để ghi lại mọi thứ cần thiết<br>vào cuốn sổ của mình,<br>để khi tôi mất trí nhớ… "
,msg5,tất cả những gì tôi cần làm<br>là đọc lại các trang trong sổ.
,msg6,"Tuy nhiên,<br>thật không may, "
,msg7,không có gì được viết<br>về cách tôi trở thành phù<br>thủy hoặc cách tôi có được<br>sức mạnh này. 
