Ignore,Key,Message
Y,メッセージ,
,msg1,There should still be <br>vegetation left in <br>Emeria’s East. <br>I’m <i>sure</i> of it. 
,msg2,"Since getting there and back’ll <br>take several days, <br>I’ll have to leave everyone <br>waiting a bit longer... <br>But, it’s better than <br>not bringing anything <br>to them at all!"
,msg3,"Clinging to that sliver of hope, <br>I wandered through <br>eastern towns and <br>Armed Force bases. "
,msg4,After searching far and wide...<br>I was able to head back to <br>the village in a carriage <br>full of food!
,msg5-1,"Everyone was <br>shocked at my return, <br>but were over <br>the moon to see me!"
,msg5-2,"We had a grand feast that day, <br>just like it was a festival!"
,msg6,"At everyone’s request, <br>I even played a song <br>on my guitar. <br>The villagers all cheered <br>along to my performance!"
,msg7,"In the midst of the festivities, <br>I didn’t even notice the sad, <br>downcast faces among the crowd..."
