Ignore,Key,Message
Y,メッセージ,
,msg1,"In the 15 years I’ve been alive, <br>I’ve never once fallen in love."
,msg2,I’m a nobleman’s daughter...
,msg3,so I always assumed that me <br>choosing the man I married <br>was out of the question.
,msg4,I admit though—<br>I was a little hopeful when <br>the marriage proposal came.
,msg5,"I thought that maybe if I got <br>married to a handsome prince,"
,msg6,even I might be able to enjoy <br>a beautiful fairy-tale romance.
,msg7,"...But, that dream never came true."
