Ignore,Key,Message
Y,メッセージ,
,msg1,"Saat aku terbaring di <br>akar berduri, aku bermimpi."
,msg2,Tentang pangeran dan <br>ksatrianya yang datang <br>menyelamatkanku... <br>Mimpi yang sangat mustahil.
,msg3,"Aku tahu itu tidak nyata, <br>tapi...aku hampir menangis <br>karena aku bahagia di situ."
,msg4,Ini yang selama ini <br>aku inginkan.
,msg5,"Tapi mimpiku segera hilang, <br>seperti diambil dariku."
,msg6,Aku membuka mata dan masih <br>berada di lantai dasar yang dingin.
,msg7,"...Tapi, hehe, <br>sungguh mengejutkan..."
,msg8,Pangeran dan ksatria dari mimpiku <br>sudah berada di depanku!
