Ignore,Key,Message
Y,メッセージ,
,msg1-1,Cha tôi đến lục địa này từ 
,msg1-2,một quốc gia sa mạc xa<br>xôi bên kia đại dương.
,msg2-1,"Ông nói rằng ông sẽ cho<br>tôi xem quê hương của<br>mình vào một ngày nào đó, "
,msg2-2,"nhưng ông lại bị ốm vì khí<br>hậu mới của lục địa này.<br>Và rồi, trong khi tôi vẫn còn<br>là smột đứa trẻ, ông đã qua đời."
,msg3-1,"Bây giờ tôi sống một<br>mình và không có tiền, "
,msg3-2,"mẹ tôi đã bỏ tôi lại<br>trong khu ổ chuột, "
,msg3-3,trước khi bà cũng biến<br>mất khỏi cuộc đời tôi.  
