Ignore,Key,Message
Y,メッセージ,
,msg1,My body began sinking <br>to the bottom of the lake.
,msg2-1,"In this world, the kindest people <br>are the first to be sacrificed."
,msg2-2,That’s why I wanted to make <br>a world where that kind girl <br>would never have to cry...
,msg3,"But, despite my best intentions, <br>I only ever left her in tears..."
,msg4,"Through my fading vision, <br>I spotted Nebra. "
,msg5,"I couldn’t even lift a finger, <br>but as soon as Nebra’s pained <br>expression entered my sight, <br>my body mysteriously <br>regained its strength."
,msg6,"Pulling her to me, <br>I breathed all of my <br>remaining oxygen into her...<br>as though giving her <br>my life itself..."
,msg7,Nebra... <br>You must...live...
