Ignore,Key,Message
Y,メッセージ,
,msg1,อะไรที่ทำให้ข้ารู้ตัวว่าเป็นแม่มดหรือ…<br>ข้าไม่รู้มาก่อนเลย
,msg2,ก่อนที่จะทันรู้ตัว<br>ข้าก็ถูกทิ้ง...<br>แล้วข้าก็ถูกรับไปเลี้ยงก่อนที่จะ<br>ทันได้รู้ตัวอีกเหมือนกัน
,msg3,ขณะละครสัตว์เร่ร่อนบังเอิ<br>ญเข้ามาเปิดการแสดงในเมือง<br>เสียงที่เปี่ยมไปด้วยชีวิตชีวาดั<br>งมาจากกระโจมสีฉูดฉาด
,msg4,การที่ได้เห็นผู้คนเดินเข้าออก<br>ด้วยรอยยิ้มสดใสบนใบหน้า...<br>ให้ความรู้สึกที่แปลก
,msg5,หลังจากที่ยืนอยู่ข้างน<br>อกตลอดทั้งการแสดง<br>ขณะละครสัตว์ก็รับข้าเข้าไปเ<br>ป็นสมาชิกคนหนึ่งของพวกเขา
,msg6,นั่นเป็นสิ่งแรก ๆ ที่ข้าจำได้
,msg7,ใช่แล้ว<br>ชีวิตของข้าเริ่มมา<br>จากคณะละครสัตว์
